{
  "$schema": "https://json-schema.org/draft/2020-12/schema",
  "$id": "https://verifrax.net/regressorium/schemas/recourse-object.schema.json",
  "title": "REGRESSORIUM Recourse Object",
  "type": "object",
  "additionalProperties": false,
  "required": [
    "object_type",
    "recourse_object_id",
    "status",
    "claim_class_ref",
    "recourse_index_ref",
    "historical_archive_ref",
    "governing_law_version_ref",
    "accepted_epoch_ref",
    "authority_object_ref",
    "execution_receipt_ref",
    "verification_result_ref",
    "recognition_object_ref",
    "subject_ref",
    "counterparty_rule_ref",
    "burden_assignment_ref",
    "remedy_matrix_ref",
    "escalation_flow_ref",
    "closure_states_ref",
    "recourse_status",
    "burden_assignment",
    "remedy_path",
    "escalation_path",
    "closure_state",
    "limits",
    "notes"
  ],
  "properties": {
    "object_type": { "const": "RecourseObject" },
    "recourse_object_id": { "type": "string", "minLength": 1 },
    "status": {
      "enum": [
        "ACTIVE_TRUTH",
        "HISTORICAL_SNAPSHOT"
      ]
    },
    "claim_class_ref": { "type": "string", "minLength": 1 },
    "recourse_index_ref": { "type": "string", "minLength": 1 },
    "historical_archive_ref": { "type": "string", "minLength": 1 },
    "governing_law_version_ref": { "type": "string", "minLength": 1 },
    "accepted_epoch_ref": { "type": "string", "minLength": 1 },
    "authority_object_ref": { "type": "string", "minLength": 1 },
    "execution_receipt_ref": { "type": "string", "minLength": 1 },
    "verification_result_ref": { "type": "string", "minLength": 1 },
    "recognition_object_ref": { "type": "string", "minLength": 1 },
    "subject_ref": { "type": "string", "minLength": 1 },
    "counterparty_rule_ref": { "type": "string", "minLength": 1 },
    "burden_assignment_ref": { "type": "string", "minLength": 1 },
    "remedy_matrix_ref": { "type": "string", "minLength": 1 },
    "escalation_flow_ref": { "type": "string", "minLength": 1 },
    "closure_states_ref": { "type": "string", "minLength": 1 },
    "recourse_status": {
      "enum": [
        "OPEN_FOR_RECOURSE",
        "BURDEN_ASSIGNED",
        "REMEDIATING",
        "ESCALATED",
        "CLOSED"
      ]
    },
    "burden_assignment": { "type": "string", "minLength": 1 },
    "remedy_path": { "type": "string", "minLength": 1 },
    "escalation_path": { "type": "string", "minLength": 1 },
    "closure_state": {
      "enum": [
        "OPEN",
        "BURDENED",
        "REMEDIATING",
        "ESCALATED",
        "CLOSED"
      ]
    },
    "limits": {
      "type": "array",
      "minItems": 1,
      "items": { "type": "string", "minLength": 1 },
      "uniqueItems": true
    },
    "notes": {
      "type": "array",
      "minItems": 1,
      "items": { "type": "string", "minLength": 1 }
    }
  }
}
